<?xml version="1.0" encoding="UTF-8"?>
<sconti xmlns:xsi="http://www.w3.org/2001/XMLSchema-instance" xsi:noNamespaceSchemaLocation="sconti.xsd"><sconto stato="attivo"><idSconto>1</idSconto><percentuale>30</percentuale><repNecess>40</repNecess><credNecess>55</credNecess><scadenza>2019-08-21</scadenza></sconto><sconto stato="attivo"><idSconto>2</idSconto><percentuale>60</percentuale><repNecess>80</repNecess><credNecess>99</credNecess><scadenza>2019-08-20</scadenza></sconto><sconto stato="attivo"><idSconto>3</idSconto><percentuale>20</percentuale><repNecess>1</repNecess><credNecess>1</credNecess><scadenza>2019-07-25</scadenza></sconto></sconti>
